<?xml version="1.0" encoding="UTF-8"?>

<!DOCTYPE test [
  <!ELEMENT test (question+)>
  <!ELEMENT question (wording,choices)>
  <!ELEMENT wording (#PCDATA)>
  <!ELEMENT choices (choice+)>
  <!ELEMENT choice (#PCDATA)>
  <!ATTLIST question id CDATA #REQUIRED>
  <!ATTLIST choice correct (yes|no) "no">
]>

<test>
  <question id="1">
    <wording>¿Dónde se encuentra Palos de la Frontera?</wording>
    <choices>
      <choice correct="yes">En la provincia de Huelva, Andalucía</choice>
      <choice>En la provincia de Cádiz</choice>
      <choice>En la comunidad de Castilla y León</choice>
      <choice>En la isla de Tenerife</choice>
    </choices>
  </question>
  <question id="2">
    <wording>¿Qué importante evento histórico está relacionado con Palos de la Frontera?</wording>
    <choices>
      <choice correct="yes">El inicio del primer viaje de Cristóbal Colón a América</choice>
      <choice>La batalla de Trafalgar</choice>
      <choice>La firma del Tratado de Tordesillas</choice>
      <choice>La invasión napoleónica</choice>
    </choices>
  </question>
  <question id="3">
    <wording>¿Qué río pasa por Palos de la Frontera?</wording>
    <choices>
      <choice correct="yes">Río Tinto</choice>
      <choice>Guadalquivir</choice>
      <choice>Guadiana</choice>
      <choice>Duero</choice>
    </choices>
  </question>
  <question id="4">
    <wording>¿Qué tres carabelas partieron desde Palos en 1492?</wording>
    <choices>
      <choice correct="yes">La Niña, la Pinta y la Santa María</choice>
      <choice>La Victoria, la Esperanza y la Trinidad</choice>
      <choice>La Concepción, la Isabel y la San Juan</choice>
      <choice>La Colón, la América y la Paloma</choice>
    </choices>
  </question>
  <question id="5">
    <wording>¿Qué monumento en Palos conmemora el viaje de Colón?</wording>
    <choices>
      <choice correct="yes">El Muelle de las Carabelas</choice>
      <choice>La Torre de Oro</choice>
      <choice>El Faro de Huelva</choice>
      <choice>El Alcázar de los Reyes Cristianos</choice>
    </choices>
  </question>
  <question id="6">
    <wording>¿Qué orden religiosa ayudó a Colón en Palos?</wording>
    <choices>
      <choice correct="yes">Los franciscanos del Monasterio de La Rábida</choice>
      <choice>Los dominicos del Monasterio de Santo Tomás</choice>
      <choice>Los cartujos de Sevilla</choice>
      <choice>Los benedictinos de San Juan</choice>
    </choices>
  </question>
  <question id="7">
    <wording>¿Qué puerto utilizó Colón para partir a América?</wording>
    <choices>
      <choice correct="yes">El Puerto de Palos</choice>
      <choice>El Puerto de Cádiz</choice>
      <choice>El Puerto de Sevilla</choice>
      <choice>El Puerto de Barcelona</choice>
    </choices>
  </question>
  <question id="8">
    <wording>¿Qué fecha marca la partida del viaje de Colón desde Palos?</wording>
    <choices>
      <choice correct="yes">3 de agosto de 1492</choice>
      <choice>12 de octubre de 1492</choice>
      <choice>1 de enero de 1492</choice>
      <choice>4 de julio de 1492</choice>
    </choices>
  </question>
  <question id="9">
    <wording>¿Qué museo se encuentra en Palos relacionado con la historia del descubrimiento?</wording>
    <choices>
      <choice correct="yes">Muelle de las Carabelas</choice>
      <choice>Museo Naval de Cádiz</choice>
      <choice>Museo Arqueológico de Sevilla</choice>
      <choice>Museo de América</choice>
    </choices>
  </question>
  <question id="10">
    <wording>¿Quién era el monarca durante el viaje de Colón desde Palos?</wording>
    <choices>
      <choice correct="yes">Los Reyes Católicos</choice>
      <choice>Felipe II</choice>
      <choice>Carlos I</choice>
      <choice>Isabel II</choice>
    </choices>
  </question>
  <question id="11">
    <wording>¿Qué personaje famoso acompañó a Colón desde Palos?</wording>
    <choices>
      <choice correct="yes">Martín Alonso Pinzón</choice>
      <choice>Fernando de Magallanes</choice>
      <choice>Hernán Cortés</choice>
      <choice>Américo Vespucio</choice>
    </choices>
  </question>
  <question id="12">
    <wording>¿Qué importancia tiene el Monasterio de La Rábida?</wording>
    <choices>
      <choice correct="yes">Allí Colón recibió apoyo para su viaje</choice>
      <choice>Fue residencia de los Reyes Católicos</choice>
      <choice>Fue construido por los romanos</choice>
      <choice>Allí se firmó el Tratado de Tordesillas</choice>
    </choices>
  </question>
  <question id="13">
    <wording>¿Cuál es el gentilicio de Palos de la Frontera?</wording>
    <choices>
      <choice correct="yes">Palermo</choice>
      <choice>Paleño</choice>
      <choice>Palense</choice>
      <choice>Palino</choice>
    </choices>
  </question>
  <question id="14">
    <wording>¿Cuál es la principal actividad económica tradicional de Palos?</wording>
    <choices>
      <choice correct="yes">La agricultura y la pesca</choice>
      <choice>La minería</choice>
      <choice>La ganadería intensiva</choice>
      <choice>El comercio marítimo internacional</choice>
    </choices>
  </question>
  <question id="15">
    <wording>¿Qué evento se celebra cada 3 de agosto en Palos?</wording>
    <choices>
      <choice correct="yes">La salida de Colón hacia América</choice>
      <choice>La feria de la fresa</choice>
      <choice>El día de San Jorge</choice>
      <choice>El descubrimiento del Nuevo Mundo</choice>
    </choices>
  </question>
  <question id="16">
    <wording>¿Cuál es uno de los productos agrícolas más conocidos de Palos?</wording>
    <choices>
      <choice correct="yes">La fresa</choice>
      <choice>La aceituna</choice>
      <choice>La uva</choice>
      <choice>El trigo</choice>
    </choices>
  </question>
  <question id="17">
    <wording>¿Qué institución educativa se encuentra cerca de Palos?</wording>
    <choices>
      <choice correct="yes">Universidad Internacional de Andalucía (UNIA)</choice>
      <choice>Universidad de Granada</choice>
      <choice>Universidad de Salamanca</choice>
      <choice>Universidad Complutense</choice>
    </choices>
  </question>
  <question id="18">
    <wording>¿Cuál es el nombre completo del pueblo?</wording>
    <choices>
      <choice correct="yes">Palos de la Frontera</choice>
      <choice>Palos del Atlántico</choice>
      <choice>Palos de América</choice>
      <choice>Puerto de Palos</choice>
    </choices>
  </question>
  <question id="19">
    <wording>¿Qué fiesta local está declarada de Interés Turístico de Andalucía?</wording>
    <choices>
      <choice correct="yes">La Fiesta de los Descubridores</choice>
      <choice>La Semana Santa</choice>
      <choice>El Carnaval de Palos</choice>
      <choice>La Romería del Rocío</choice>
    </choices>
  </question>
  <question id="20">
    <wording>¿Qué título honorífico ostenta Palos de la Frontera?</wording>
    <choices>
      <choice correct="yes">Cuna del Descubrimiento</choice>
      <choice>Ciudad Patrimonio</choice>
      <choice>Villa Real</choice>
      <choice>Ciudad Imperial</choice>
    </choices>
  </question>
</test>